<?xml version="1.0" encoding="UTF-8"?>
<rendertheme xmlns="http://mapsforge.org/renderTheme" xmlns:xsi="http://www.w3.org/2001/XMLSchema-instance"
	xsi:schemaLocation="http://mapsforge.org/renderTheme https://raw.githubusercontent.com/mapsforge/mapsforge/dev/resources/renderTheme-v4.xsd"
	version="4" map-background="#f8f8f8" map-background-outside="#dddddd">

	<rule e="way" k="natural" v="issea|sea">
		<area fill="#B3DDFF"/>
	</rule>

	<rule e="way" k="natural" v="nosea">
		<area fill="#F8F8F8" stroke="#F8F8F8" stroke-width="1.0"/>
	</rule>

	<!-- ways -->
	<rule e="way" k="*" v="*">
		<!-- landuse -->
		<rule e="way" k="landuse" v="*">
			<rule e="way" k="landuse" v="military">
				<area src="jar:patterns/military.png" stroke="#e4e4e4" stroke-width="0.2" />
			</rule>
			<rule e="way" k="landuse" v="residential|farmyard">
				<area fill="#e4e4e4" />
			</rule>
			<rule e="way" k="landuse" v="retail">
				<area fill="#ffebeb" stroke="#e4e4e4" stroke-width="0.2" />
			</rule>
			<rule e="way" k="landuse" v="industrial|brownfield|railway">
				<area fill="#ecd8ff" stroke="#e4e4e4" stroke-width="0.2" />
			</rule>
			<rule e="way" k="landuse" v="commercial">
				<area fill="#ffffc0" stroke="#e4e4e4" stroke-width="0.2" />
			</rule>
			<rule e="way" k="landuse" v="construction|greenfield">
				<area fill="#a47c41" stroke="#e4e4e4" stroke-width="0.2" />
			</rule>
			<rule e="way" k="landuse" v="garages">
				<area fill="#d6d6e4" />
			</rule>

			<rule e="way" k="*" v="*" zoom-min="16">
				<caption k="name" font-style="bold" font-size="10" fill="#4040ff" stroke="#ffffff" stroke-width="2.0" />
			</rule>
		</rule>


		<!-- tunnel -->
		<rule e="way" k="tunnel" v="true|yes">
			<!-- highway tunnels -->
			<rule e="way" k="highway" v="*">
				<!-- highway tunnel casings -->
				<rule e="way" k="highway" v="steps|footway|path">
					<line stroke="#707070" stroke-width="0.6" stroke-dasharray="5,5" stroke-linecap="butt" />
				</rule>
				<rule e="way" k="highway" v="track|cycleway|bridleway|service">
					<line stroke="#707070" stroke-width="1.0" stroke-dasharray="5,5" stroke-linecap="butt" />
				</rule>
				<rule e="way" k="highway" v="construction">
					<line stroke="#707070" stroke-width="1.1" stroke-dasharray="5,5" stroke-linecap="butt" />
				</rule>
				<rule e="way" k="highway" v="road">
					<line stroke="#707070" stroke-width="1.3" stroke-dasharray="5,5" stroke-linecap="butt" />
				</rule>
				<rule e="way" k="highway" v="pedestrian|unclassified|residential|living_street|byway">
					<line stroke="#707070" stroke-width="1.5" stroke-dasharray="5,5" stroke-linecap="butt" />
				</rule>
				<rule e="way" k="highway" v="tertiary|secondary_link|primary_link|trunk_link|motorway_link|secondary|primary|trunk">
					<line stroke="#707070" stroke-width="1.8" stroke-dasharray="5,5" stroke-linecap="butt" />
				</rule>
				<rule e="way" k="highway" v="motorway">
					<line stroke="#707070" stroke-width="2.0" stroke-dasharray="5,5" stroke-linecap="butt" />
				</rule>

				<!-- highway tunnel cores -->
				<rule e="way" k="highway" v="steps|footway|path">
					<line stroke="#ffffff" stroke-width="0.45" stroke-dasharray="5,5" stroke-linecap="butt" />
				</rule>
				<rule e="way" k="highway" v="track">
					<line stroke="#ffffff" stroke-width="0.7" stroke-dasharray="5,5" stroke-linecap="butt" />
				</rule>
				<rule e="way" k="highway" v="cycleway|bridleway|service">
					<line stroke="#ffffff" stroke-width="0.85" stroke-dasharray="5,5" stroke-linecap="butt" />
				</rule>
				<rule e="way" k="highway" v="construction">
					<line stroke="#ffffff" stroke-width="1.0" stroke-dasharray="5,5" stroke-linecap="butt" />
				</rule>
				<rule e="way" k="highway" v="road">
					<line stroke="#ffffff" stroke-width="1.25" stroke-dasharray="5,5" stroke-linecap="butt" />
				</rule>
				<rule e="way" k="highway" v="pedestrian|unclassified|residential|living_street|byway">
					<line stroke="#ffffff" stroke-width="1.35" stroke-dasharray="5,5" stroke-linecap="butt" />
				</rule>
				<rule e="way" k="highway" v="tertiary_link|tertiary|secondary_link|primary_link|trunk_link|motorway_link|secondary|primary|trunk">
					<line stroke="#ffffff" stroke-width="1.5" stroke-dasharray="5,5" stroke-linecap="butt" />
				</rule>
				<rule e="way" k="highway" v="motorway">
					<line stroke="#ffffff" stroke-width="1.7" stroke-dasharray="5,5" stroke-linecap="butt" />
				</rule>
			</rule>

			<!-- railway tunnel -->
			<rule e="way" k="railway" v="*">
				<rule e="way" k="railway" v="tram|subway|light_rail|narrow_gauge">
					<line stroke="#880f0f4c" stroke-width="0.25" stroke-dasharray="4,4" stroke-linecap="butt" />
				</rule>
				<rule e="way" k="railway" v="rail">
					<line stroke="#aa333333" stroke-width="0.4" stroke-dasharray="4,4" stroke-linecap="butt" />
				</rule>
			</rule>
		</rule>


		<!-- landuse -->
		<rule e="way" k="landuse" v="*">
			<rule e="way" k="landuse" v="landfill|quarry">
				<area fill="#e9dd72" stroke="#556b2f" stroke-width="0.2" />
			</rule>
			<rule e="way" k="landuse" v="cemetery">
				<area src="jar:patterns/cemetery.png" stroke="#e4e4e4" stroke-width="0.2" />
			</rule>
			<rule e="way" k="landuse" v="field|farm|farmland|meadow|grass">
				<area fill="#ebfff2" stroke="#9ee673" stroke-width="0.1" />
			</rule>
			<rule e="way" k="landuse" v="allotments|village_green|recreation_ground">
				<area fill="#bde3cb" stroke="#6fc13d" stroke-width="0.2" />
			</rule>
			<rule e="way" k="landuse" v="reservoir|basin">
				<area fill="#b5d6f1" />
			</rule>

			<rule e="way" k="*" v="*" zoom-min="16">
				<caption k="name" font-style="bold" font-size="10" fill="#4040ff" stroke="#ffffff" stroke-width="2.0" />
			</rule>
		</rule>


		<rule e="way" k="natural|landuse" v="forest|wood|scrub">
			<rule e="way" k="wood" v="*">
				<rule e="way" k="wood" v="coniferous">
					<area src="jar:patterns/wood-coniferous.png" />
				</rule>
				<rule e="way" k="wood" v="deciduous">
					<area src="jar:patterns/wood-deciduous.png" />
				</rule>
				<rule e="way" k="wood" v="mixed">
					<area src="jar:patterns/wood-mixed.png" />
				</rule>
			</rule>
			<rule e="way" k="wood" v="~">
				<area fill="#6fc18e" stroke="#6fc18e" stroke-width="0.2" />
			</rule>

			<rule e="way" k="*" v="*" zoom-min="16">
				<caption k="name" font-style="bold" font-size="10" fill="#4040ff" stroke="#ffffff" stroke-width="2.0" />
			</rule>
		</rule>


		<!-- amenity -->
		<rule e="way" k="amenity" v="*">
			<rule e="way" k="amenity" v="kindergarten|school|college|university">
				<area fill="#cdabde" stroke="#e9dd72" stroke-width="0.2" />
			</rule>
			<rule e="way" k="amenity" v="grave_yard">
				<area src="jar:patterns/cemetery.png" stroke="#e4e4e4" stroke-width="0.2" />
			</rule>
			<rule e="way" k="amenity" v="parking">
				<area fill="#ffffc0" stroke="#e9dd72" stroke-width="0.2" />
				<rule e="way" k="access" v="private" zoom-min="15">
					<area src="jar:patterns/access-private.png" />
				</rule>
				<rule e="way" k="*" v="*" zoom-min="17">
					<symbol src="jar:symbols/parking.svg" />
				</rule>
			</rule>
			<rule e="way" k="amenity" v="fountain" closed="yes">
				<area fill="#b5d6f1" stroke="#000080" stroke-width="0.15" />
				<rule e="way" k="*" v="*" zoom-min="17">
					<symbol src="jar:symbols/fountain.svg" />
				</rule>
			</rule>
			<rule e="way" k="amenity" v="hospital" zoom-min="15">
				<symbol src="jar:symbols/hospital.svg" />
			</rule>
			<rule e="way" k="amenity" v="theatre" zoom-min="17">
				<symbol src="jar:symbols/theatre.svg" />
			</rule>
			<rule e="way" k="amenity" v="toilets" zoom-min="17">
				<symbol src="jar:symbols/toilets.svg" />
			</rule>

			<rule e="way" k="*" v="*" zoom-min="17">
				<caption k="name" font-style="bold" font-size="10" fill="#4040ff" stroke="#ffffff" stroke-width="2.0" />
			</rule>
		</rule>


		<!-- natural -->
		<rule e="way" k="natural" v="*">
			<rule e="way" k="natural" v="glacier">
				<area fill="#fafaff" stroke="#add8e6" stroke-width="0.8" />
			</rule>
			<rule e="way" k="natural" v="land">
				<area fill="#f8f8f8" stroke="#e0e0e0" stroke-width="0.1" />
			</rule>
			<rule e="way" k="natural" v="beach">
				<area fill="#eecc55" />
			</rule>
			<rule e="way" k="natural" v="heath">
				<area fill="#ffffc0" stroke="#ffff90" stroke-width="0.2" />
			</rule>
			<rule e="way" k="natural" v="marsh|wetland">
				<area src="jar:patterns/marsh.png" />
			</rule>

			<rule e="way" k="*" v="*" zoom-min="16">
				<caption k="name" font-style="bold" font-size="10" fill="#4040ff" stroke="#ffffff" stroke-width="2.0" />
			</rule>
		</rule>


		<!-- leisure -->
		<rule e="way" k="leisure" v="*">
			<rule e="way" k="leisure" v="park|garden|golf_course|common|green">
				<area fill="#c7f1a3" stroke="#6fc18e" stroke-width="0.2" />
			</rule>
			<rule e="way" k="leisure" v="playground|playing_fields|pitch|dog_park">
				<area fill="#c7f1a3" stroke="#6fc18e" stroke-width="0.2" />
				<rule e="way" k="*" v="playground" zoom-min="17">
					<symbol src="jar:symbols/playground.svg" />
				</rule>
			</rule>
			<rule e="way" k="leisure" v="nature_reserve">
				<area src="jar:patterns/nature-reserve.png" stroke="#6fc18e" stroke-width="0.2" />
			</rule>

			<rule e="way" k="leisure" v="stadium|sports_centre|water_park">
				<area fill="#bde3cb" stroke="#6fc18e" stroke-width="0.2" />
			</rule>
			<rule e="way" k="leisure" v="track">
				<rule e="way" k="area" v="yes|true">
					<area fill="#bde3cb" stroke="#6fc18e" stroke-width="0.025" />
				</rule>
				<rule e="way" k="area" v="~|no|false">
					<line stroke="#6fc18e" stroke-width="0.75" />
					<line stroke="#bde3cb" stroke-width="0.7" />
				</rule>
			</rule>
			<rule e="way" k="leisure" v="swimming_pool">
				<area fill="#b5d6f1" stroke="#6060ff" stroke-width="0.2" />
			</rule>

			<rule e="way" k="*" v="*" zoom-min="16">
				<caption k="name" font-style="bold" font-size="10" fill="#4040ff" stroke="#ffffff" stroke-width="2.0" />
			</rule>
		</rule>